{"$schema":"https://json-schema.org/draft/2020-12/schema","$id":"https://nepa.local/schemas/calibration-attempt-declaration.schema.json","title":"Prompt development attempt declaration","type":"object","additionalProperties":false,"required":["schema_version","lineage_id","version","attempt","status","prompt_ref","prompt_sha256","trial_count","semantic_depth","model_ids"],"properties":{"schema_version":{"const":"2.0"},"lineage_id":{"type":"string","pattern":"^[0-9a-f]{64}$"},"version":{"enum":["v0","v1","v2"]},"attempt":{"type":"integer","minimum":1},"status":{"const":"declared"},"prompt_ref":{"$ref":"#/$defs/ref"},"prompt_sha256":{"type":"string","pattern":"^[0-9a-f]{64}$"},"trial_count":{"const":5},"semantic_depth":{"const":1},"model_ids":{"const":["qwen","claude","deepseek"]}},"$defs":{"ref":{"type":"object","additionalProperties":false,"required":["path","sha256"],"properties":{"path":{"type":"string","pattern":"^[A-Za-z0-9._-]+(?:/[A-Za-z0-9._-]+)*$"},"sha256":{"type":"string","pattern":"^[0-9a-f]{64}$"}}}}}
