{"schema_version":"2.0","lineage_id":"aaaaaaaaaaaaaaaaaaaaaaaaaaaaaaaaaaaaaaaaaaaaaaaaaaaaaaaaaaaaaaaa","version":"v0","attempt":1,"status":"declared","prompt_ref":{"path":"prompt-development/versions/v0/prompt.md","sha256":"bbbbbbbbbbbbbbbbbbbbbbbbbbbbbbbbbbbbbbbbbbbbbbbbbbbbbbbbbbbbbbbb"},"prompt_sha256":"bbbbbbbbbbbbbbbbbbbbbbbbbbbbbbbbbbbbbbbbbbbbbbbbbbbbbbbbbbbbbbbb","trial_count":5,"semantic_depth":1,"model_ids":["qwen","claude","deepseek"]}
